{
  "$schema": "./founder-stack-updates.schema.json",
  "manifestVersion": 1,
  "publishedAt": "2026-09-29T02:27:49Z",
  "product": "founder-ide-next",
  "channel": "stable",
  "latestVersion": "1.0.130",
  "minimumVersion": "1.0.130",
  "releaseNotesUrl": "https://github.com/danishhaiderau-maker/founder-ide-releases/releases/tag/v1.0.130",
  "releases": [
    {
      "version": "1.0.130",
      "status": "current",
      "releasedAt": "2026-09-29T02:27:49Z",
      "foundation": "electron",
      "download": {
        "url": "https://github.com/danishhaiderau-maker/founder-ide-releases/releases/download/v1.0.130/Founder-IDE-Next-QA-Setup-1.0.130.exe",
        "size": 1240786166,
        "sha256": "5c105d8bfb1d2f91d9507ea26ed0e14ff65a439c6f764b68a0425aeb4506d3e3",
        "signature": null
      },
      "minimumVersion": "1.0.130",
      "rollback": {
        "mechanism": "manual",
        "previousVersionKept": false,
        "note": "Founder IDE Next QA NSIS installer from the public founder-ide-releases channel; the EXE is not code-signed yet. It replaces the earlier Founder-Stack 0.9.x channel, which is a different product, so 0.9.x clients must install it fresh. Roll back by reinstalling an earlier founder-ide-releases installer; the FounderVault is never touched by the installer."
      }
    }
  ]
}
